{
  "schema_version": 1,
  "command_id": "chatgpt-web-existing-work-preflight-002-000001",
  "correlation_id": "chatgpt-web-existing-work-preflight-002-round-1",
  "target_head_expected": "2fc399ac7b415746763114c3951aa2e3b45adee7",
  "target_head_observed": "2fc399ac7b415746763114c3951aa2e3b45adee7",
  "target_tree_expected": "9e2d22b7caf001449d1a5aa4fd374fec81a415fe",
  "target_tree_observed": "9e2d22b7caf001449d1a5aa4fd374fec81a415fe",
  "chatgpt_web_reachable": true,
  "chatgpt_auth_state": "AUTH_REQUIRED",
  "chatgpt_ui_visible": true,
  "work_ui_visible": false,
  "existing_work_list_visible": false,
  "preferred_work_title_found": "UNKNOWN",
  "existing_work_openable": "UNKNOWN",
  "same_account_context_verified": "UNKNOWN",
  "message_sent": false,
  "target_model_turn_started": false,
  "new_work_created": false,
  "browser_started": true,
  "human_auth_started": false,
  "jules_started": false,
  "credential_material_persisted": false,
  "chat_or_session_identifier_persisted": false,
  "retry_count": 0,
  "fallback_used": false,
  "classification": "BLOCKED_AUTH",
  "route_decision": "UNKNOWN",
  "evidence_refs": [
    "browser:chatgpt-web-auth-required-observation",
    "github:pr4-head-tree-readback"
  ],
  "created_at": "2026-09-24T06:41:45Z"
}
